,doc_description,doc_full_name,doc_status,article_id
681,mrt circl line hit spate mysteri disrupt recent month caus confus distress thousand commut colleagu the…,How the Circle Line rogue train was caught with data,Live,680
682,develop scientist line busi user abl run real analyt app end end singl python notebook i’ll pixiedust librari,Real-Time Sentiment Analysis of Twitter Hashtags with Spark (+ PixieDust),Live,681
683,work notebook scienc experi easier releas featur listen feedback easier load json object…,Easy JSON Loading and Social Sharing in DSX Notebooks,Live,682
684,watch creat bluemix applic node red search tweet store result tweet cloudant nosql databas wareh tool built cloudant load dashdb,"Store Tweets Using Bluemix, Node-RED, Cloudant, and dashDB",Live,683
685,today we’r excit announc flexdashboard packag enabl easili creat flexibl attract interact dashboard author custom dashboard,flexdashboard: Interactive dashboards for R,Live,684
686,ibm watson offer collect rest api creat run manag troubleshoot flow allow applic easili integr refineri,Working with data flows using  Watson Data APIs,Live,685
687,watch video ibm watson ibm scienc experi creat flow ibm spss model predict chronic,"Score a Predictive Model Built with IBM SPSS Modeler, WML & DSX",Live,686
688,work format raw user friendli instanc format larg binari file spread hundr text file an…,Easy Access to All Points of Interest Data – IBM Watson Data Lab – Medium,Live,687
689,chang year i’v build web app i’v love open natur web platform gatekeep web tell what…,Offline Sync for Progressive Web Apps – IBM Watson Data Lab – Medium,Live,688
690,boost reliabl cach mode compos disabl backup persist default redi deploy mode enabl turn,Improved Performance for Redis Cache Mode on Compose,Live,689
691,ad power facet search featur app websit easier think quickli turn spreadsheet polish search featur,Simple Search Service,Live,690
693,post look way connect compos postgresql deploy run queri develop environ compos postgresql,Connecting R and Compose PostgreSQL,Live,691
694,beginn page exampl tutori cover basic,15 Page Tutorial for R,Live,692
695,open sourc code python popular low cost flexibl power requir properli creat code ensur work correctli be…,Better together: SPSS and Data Science Experience,Live,693
696,load raster dashdb detail analysi python,"Predict temperatures using dashDB, Python, and R",Live,694
697,blog leverag previou post introduc work object storag scienc experi dsx order read excel file panda datafram instal,Excel files: Loading from Object Storage — Python,Live,695
698,second entri mongo metric seri look mongodb aggreg pipelin comput median set,Mongo Metrics: Finding a Happy Median,Live,696
699,video tom krouper github introduc ost compar exist onlin schema chang tool,DataLayer Conference: Online Schema Migrations for MySQL Using gh-ost,Live,697
700,chartio platform ibm dashdb cloud warehous build power dashboard sourc stripe salesforc,Visualizing Stripe Data With Chartio,Live,698
701,articl calcul weight move averag postgresql,Metrics Maven: Calculating a Weighted Moving Average in PostgreSQL,Live,699
702,graph articl seri graph databas explor graph algorithm ground you’v wonder graph databas good approach problem you’r tri solv graph seri,Magical Markov Chains,Live,700
703,miss common excit problem statist analysi necessari evalu qualiti differ sourc user responding…,Missing data conundrum: Exploration and Imputation Techniques,Live,701
704,read access premis relat databas server cloud bluemix app,Access an On-Premises DB2 Data Server from the Bluemix Cloud,Live,702
705,creat contact manag app store apach couchdb databas,Building CouchApps,Live,703
706,agin workbench free applic known best work ibm’ puredata analyt netezza launch dashdb agin releas version workbench provid familiar interfac work cloud warehous,Use Aginity Workbench for IBM dashDB,Live,704
707,amaz abl hard present day problem translat studi centuri case transform word vector,Word2Vec in Data Products,Live,705
708,here’ week’ news scienc big,"This Week in Data Science (August 16, 2016)",Live,706
709,cloudant soon run apach couchdb code base today announc sandbox cluster function test,Cloudant <3 Apache CouchDB™ 2.0,Live,707
710,video show access set ibm scienc experi,Load and analyze public data sets in DSX,Live,708
711,recent releas redi offici geo api mainstream branch memori databas curiou read,A Quick Guide to Redis 3.2's Geo Support,Live,709
712,gareth dwyer write sqlalchemi python sql toolkit orm discuss advantag perform databas oper postgresql,Using PostgreSQL through SQLAlchemy,Live,710
713,compos postgresql perform cross databas queri extens recent avail postgr fdw dblink articl walk set databas advantag,Cross-Database Querying in Compose PostgreSQL,Live,711
714,go introduc openstreemap import compos postgresql deploy queri non convent store hstore column,GeoFile: Using OpenStreetMap Data in Compose PostgreSQL - Part I,Live,712
715,postgresql user control number incom connect allow deploy control compos web consol postgresql databas set,PostgreSQL connection limit control,Live,713
716,big crop book apach spark™ look best introduct beginn deep dive guid optim scale,A Survey of Books about Apache Spark™,Live,714
717,system “adversari networks” develop creativ origin fluidli mix match real world inform,"For AI to Get Creative, It Must Learn the Rules--Then How to Break 'Em",Live,715
718,omondi campu discount founder cto discuss secur applic oauth show secur store authent mysql mongodb,Simple OAuth With MongoDB & MySQL,Live,716
719,queri json cloudant couchdb element insid array valu,Index Array Elements & Query JSON,Live,717
720,screencast introduc ecto start overview entir stack ecto work erlang elixir phoenix walk ecto postgresql creat mix project configur databas access seed end simpl queri,The Database Tool for Elixir and Phoenix,Live,718
721,page includ number util migrat transform note case tool compat apach couchdb work cloudant includ refer,Data Migration & Transformation Tools,Live,719
722,visual playbook seri help scientist analyst profession understand key identifi creat good visual take depth look len scienc goal introduc strategi techniqu thorough analysi turn set point visual reveal scienc work scene,Data Visualization Playbook: Telling the Data Story,Live,720
723,look practic applic specif spark algorithm advanc analyt case,The power of machine learning in Spark,Live,721
724,love feel have think world especi love there’ vagu idea get formal concret concept inform theori prime exampl,Visual Information Theory ,Live,722
725,algorithm divid broad categories — supervis unsupervis reinforc,10 Essential Algorithms For Machine Learning Engineers,Live,723
726,current rapid grow rapidli grow tension hand research lab open — publish result arxiv push code github competit fierc domin player deep framework cloud comput platform custom hardwar battl standard near possibl long term futur technolog,NIPS 2016 — Day 2 Highlights,Live,724
727,here’ week’ news scienc big,"This Week in Data Science (March 7, 2017)",Live,725
728,dataset upload dataset month saw great number except script creat month’ blog featur script week you’ll,May 2016: Scripts of the Week,Live,726
729,blog post help understand relationship differ dimens python list numpi array show help tip,From Python Nested Lists to Multidimensional numpy Arrays,Live,727
730,week ago raj singh demonstr chatbot call cognit event finder ibm’ instal sxsw chatbot allow user search tech session music gig film…,"The Most Popular Search Term at SXSW, According to Our Chatbot",Live,728
731,helper librari jupyt notebook improv user experi work make chart breez,PixieDust 1.0 is here! – IBM Watson Data Lab,Live,729
732,deploy python applic ibm stream analyt servic ibm bluemix instal ibm stream,Developing for the IBM Streaming Analytics service,Live,730
733,bcrypt intent slow hash function slow sound paradox come password hash isn good guy bad slow,You may get pwned! At least protect passwords with bcrypt.,Live,731
734,flow offer interact graphic environ ingest clean tune model organ workflow visual collabor ecosystem tool advantag spark spss model runtim acceler develop deploy,Rapidly build Machine Learning flows with DSX,Live,732
735,walk creation sampl applic call geopix leverag ibm mobilefirst ibm bluemix captur imag attach local offlin replic chang onlin store user experi compromis,Mobile Apps Offline and Online,Live,733
736,omondi campu discount founder cto talk case fetch multipl databas join rabbitmq rpc,Asynchronous Joins Using RabbitMQ,Live,734
737,articl attempt highlight conceptu piec bia varianc attempt demystifi extent hope greater number peopl abl debug agent’ process greater confid,Making Sense of the Bias / Variance Trade-off in (Deep) Reinforcement Learning,Live,735
738,here’ week’ news scienc big,"This Week in Data Science (September 20, 2016)",Live,736
739,pouchdb databas it’ json document store precis allow creat read updat delet queri document simpl javascript api pouchdb commonli,PouchDB: the Swiss Army Knife of databases – IBM Watson Data Lab – Medium,Live,737
740,post show suit microservic adher philosophi standalon microservic extend expand scalabl predict servic discoveri tool,Simple Service Registry,Live,738
741,lucero del alba talk postgresql materi view process larg amount slow databas,Store Result Sets with Materialized Views in PostgreSQL,Live,739
742,hear scientist but… better,10 pieces of advice to beginner data scientists,Live,740
743,simpl search servic exampl app easili expos facet search api cloudant build search game throne charact,Easy Frontends for Simple Search API Using GoT Data,Live,741
744,bradley holt present webinar deploy stack applic ibm bluemix quickli easili add cloudant servic bluemix applic valu cloudant nosql databas servic dbaa excel replic sync make avail user non stop elast scalabl high avail integr secur join bradley holt develop advoc cloudant explor bluemix applic manifest buildpack deploy script procfil configur bluemix applic,Deploying a Full Stack Node.js Application to IBM Bluemix,Live,742
745,colleagu cloud servic blog journey databas avail ibm bluemix cloud interest seven stop time destin compos,Seven Databases in Seven Days – a Cloud Data Services journey,Live,743
746,amaz abl hard present day problem translat studi centuri case transform words…,Spark-based machine learning tools for capturing word meanings,Live,744
747,recent sat cto scylladb avi kiviti talk scylla root approach cassandra compat scylla go,Talking ScyllaDB with CTO Avi Kivity,Live,745
748,httr avail cran httr packag make easi talk web api quick start vignett instal latest version “httr…,httr 1.2.0,Live,746
749,articl focu network address type work help store address databas,Storing Network Addresses using PostgreSQL,Live,747
750,geofil seri dedic look geograph featur use articl discuss spatial refer system epsg code databas handl transform,GeoFile: Spatial Reference Systems and Databases,Live,748
751,project show hurrican harvey bring record set rain houston graphic desk york time start explor way show rainfal,Hurricane How-To,Live,749
752,cloudant geospati watch quick intro geojson,Introducing Cloudant Geospatial,Live,750
753,watch video logist regress classifi publicli avail metabol diseas determin chronic,Build a Predictive Analytic Model,Live,751
754,nosql forc defin schema document isn schema databas flexibl alter blog post describ techniqu organis minimis storag retain document readabl,“Schemas” in CouchDB,Live,752
755,post outlin secur aspect consid make non public relat avail jupyt scienc notebook,Sharing non-public data in Jupyter notebooks – IBM Watson Data Lab – Medium,Live,753
756,telekinesi abil object thought longer far fetch realiti muse™ wearabl devic collect brain wave signal arduino devic python program articl demonstr toy car power mind tutori describ web applic run ibm bluemix develop store brain activ collect muse,Move a toy car with your mind,Live,754
757,cover map elasticsearch,Getting started with Elasticsearch and Node.js - part 2,Live,755
758,build mobil web app pouchdb angularj ibm cloudant global distribut layer web mobil app quickli integr cloudant cloudant client librari eas manag deploy applic ibm bluemix,"Mobile Web Apps with PouchDB, AngularJS, Node.js and IBM Cloudant",Live,756
759,quickli work notebook rstudio ibm scienc experi dsx point access databas resid some…,Working with on-premises databases — Step by Step,Live,757
760,skill daili challeng actual scientist think critic role scienc,A glimpse inside the mind of a data scientist,Live,758
762,predict model broken clock,Are Your Predictive Models like Broken Clocks?,Live,759
763,launch seti ibmcloud seti analysi ibm bluemix scienc experi spark object storag built ibm dashdb cloudant cloud foundri,"SETI data, publicly available, from IBM",Live,760
764,post i’ll demo variat auto encod kingma “frey faces” dataset kera deep python librari,"Variational auto-encoder for ""Frey faces"" using keras",Live,761
765,explain minut,From Machine Learning to Learning Machine (Dinesh Nirmal),Live,762
766,video show upload csv analyt rstudio ibm scienc experi dsx,Load data into RStudio for analysis in DSX,Live,763
767,tidi messi sure answer question worri understand minut question issu keep busi scientist statistician learner pick favorit issu prepar known spent scienc project spent prepar littl spent actual model prepar known step includ deal miss valu replac,Tidy Data In Python,Live,764
768,descript,Announcing the Data Browser for JanusGraph,Live,765
769,we’r spend interview scientist world understand work interact peer stakehold today scienc is…,Making data science a team sport,Live,766
770,microservic product sure commun secur reliabl explor rabbitmq altern transport senacaj microservic easi plug compos rabbitmq microservic stack,Building Secure Distributed Javascript Microservices with RabbitMQ and SenecaJS,Live,767
771,python statement commonli handl condit code articl concept syntax,Python If Statements Explained (Python For Data Science Basics #4),Live,768
772,evolv mongodb redi elasticsearch campu discount founder cto omondi talk compani switch power user recommend feed,Powering social feeds and timelines with Elasticsearch,Live,769
773,have troubl get java connect compos mongodb ssl enabl tri librari trick work environ,Easier Java connections to MongoDB at Compose,Live,770
774,convert cloudant json differ format read json spreadsheet calendar aggreg rss reader,"Export Cloudant JSON as CSV, RSS, or iCal",Live,771
775,help hit ground run we’v provid sampl script start fast biginsight script test biginsight cloud bluemix work biginsight premis version,BigInsights Sample Scripts,Live,772
776,increas app respons spare servic cachemachin cloudant librari cach http servic redi cach store,Caching Cloudant Requests with cachemachine,Live,773
777,articl connect applic mongodb databas lay groundwork fulli authent applic author rout,"Authenticating Node-RED using JSONWebToken, part 2",Live,774
778,articl look postgraphql librari provid graphql schema creat select postgresql schema give easi connect postgresql databas automat detect primari key relationship tabl type function queri graphql server,PostGraphQL: PostgreSQL meets GraphQL,Live,775
779,weather compani api matplotlib gener weather forecast map python notebook,Your own weather forecast in a Python notebook,Live,776
780,second seri build smart busi chatbot we’ll slackbot connect watson convers dialog,Making of a Smart Business Chatbot: Part 2,Live,777
781,video provid overview govern featur ibm catalog,Governance overview for IBM Data Catalog,Live,778
782,go look connect applic compos mysql databas,Connecting applications to Compose for MySQL,Live,779
783,provid brief overview popular databas manag tool right compos mysql deploy mysql workbench sequel pro dbeaver,Database Management Tools and Compose for MySQL,Live,780
784,look empir bay method multipl sampl size,Empirical Bayes for multiple sample sizes,Live,781
785,matplotlib valuabl misunderstood foundat python scienc stack,Effectively Using Matplotlib,Live,782
786,rabbitmq power flexibl messag broker great fit modern app articl provid queue setup strategi process messag failur grace,Handling Failure Successfully in RabbitMQ – IBM Watson Data Lab,Live,783
787,rapid chang scienc podcast great updat develop,"10 Data Science, Machine Learning and AI Podcasts You Must Listen To",Live,784
788,dygraph packag interfac dygraph javascript chart librari provid rich facil chart seri includ automat plot xt seri ob…,Interactive time series with dygraphs,Live,785
789,latest enhanc compos make life simpler secur introduct tl ssl certif back verifi encrypt initi roll certif scheme user rabbitmq elasticsearch,Getting Connected with RabbitMQ and Elasticsearch,Live,786
790,watch ibm dashdb analyt,Cloud Data Services,Live,787
791,articl explain concept recommend system python build graphlab librari explain type engin,Quick Guide to Build a Recommendation Engine in Python,Live,788
792,recent arriv encrypt tl ssl certif support compos elasticsearch rabbitmq notic issu pop rabbit hole encrypt support,Java and Let's Encrypt certificates,Live,789
793,taken beta label messag platform upgrad deploy rabbitmq version includ featur lazi queue,Compose RabbitMQ now out of beta,Live,790
794,survey command line tool interfac ibm cloudant apach couchdb,Command-line tools for Cloudant and CouchDB,Live,791
795,turn mongo databas rest api restheart run quickli articl explor restheart expos rest api directli mongo databas compos,Building Instant RESTFul API's with MongoDB and RESTHeart,Live,792
796,ibm watson platform offer collabor ecosystem analyt tool cognit servic discoveri manag govern capabl design team minim take solv problem,"10 Powerful Features on Watson Data Platform, No Coding Necessary",Live,793
797,discuss issu comput “area curve” auc,On calculating AUC,Live,794
798,tri man i rec came brian granger jake vanderplas’ altair promis young visual librari altair suit address python’ ggplot envi,A Dramatic Tour through Python’s Data Visualization Landscape (including ggplot and Altair),Live,795
799,amazon dynamodb servic ibm cloudant apach couchdb dynamodb peculiar form json single…,Moving data from DynamoDB to Cloudant or CouchDB – IBM Watson Data Lab,Live,796
800,enhanc simpl search servic app api,Reintroducing the Simple Search Service,Live,797
801,click deploy ibm bluemix host wordpress ghost environ compos mysql maintain databas tri customis typic host,Blogging without the hosting – IBM Watson Data Lab,Live,798
802,ibm cloudant fulli manag nosql databas servic apach couchdb™ cloudant’ web provid json view tabl view includ,Eye Candy for Cloudant – IBM Watson Data Lab – Medium,Live,799
803,blog “busi differenti learning” introduc describ concept trace origin scienc project watson show…,Machine Learning for the Enterprise,Live,800
804,spark stream ibm watson track convers trend twitter,Sentiment Analysis of Twitter Hashtags,Live,801
805,provis mysql databas compos connect minut,Connecting to Compose for MySQL,Live,802
806,user behavior track analysi web app site captur detail event action chang url,Simple Website Metrics,Live,803
807,busi provid highest qualiti experi client thing worri databas human design solv problem compos mongodb stack solut creat non profit client,Making the most of Compose: Customer case study with Human Design,Live,804
808,today step make simpl access launch ibm watson watson design machine…,Machine Learning for everyone,Live,805
809,video show add collabor project ibm scienc experi dsx,Collaborate on projects in DSX,Live,806
810,here’ week’ news scienc big,"This Week in Data Science (August 23, 2016)",Live,807
811,spoke christoph quinon project lead develop compos janusgraph scoop graph databas janusgraph commun team usag scylla,"Interview: Christopher Quinones on the newest graph database, JanusGraph",Live,808
812,apach spark librari mllib ibm analyt apach spark ibm bluemix,Use the Machine Learning Library,Live,809
813,commit code github divulg secret api key allow account isn’t rare event develop accident commit credenti others…,"Environment variables, or keeping your secrets secret in a Node.js app – IBM Watson Data Lab",Live,810
814,common reason map calcul distanc point redi postgi come command geodist distanc allow easili reason choos databas better choic case,Getting the distance using Redis and PostgreSQL,Live,811
815,post seri cover exercis andrew class coursera,"Machine Learning Exercises In Python, Part 1",Live,812
816,gener adversari network gan class neural network unsupervis help solv task imag gener descript get high…,Generative Adversarial Networks (GANs),Live,813
817,run alexa skill serverless pay traffic gener skill get popular,Add custom Alexa skills with OpenWhisk and Cloudant – IBM Watson Data Lab,Live,814
818,report import confer cover latest innov apach spark python analyt,What I learned at PyCon and Spark Summit,Live,815
819,excit moder panel discuss sxsw year offlin uniniti smallest nutshel offlin concern build applic meet…,Offline First FOMO,Live,816
820,ibm cloud servic proudli sponsor girl develop leadership summit develop advoc report event austin,Girl Develop It Leadership Summit Recap,Live,817
821,databas back microservic power articl senecaj nodej compos databas creat virtual product catalog,Building JavaScript Microservices with SenecaJS and Compose,Live,818
822,import restor databas mongodb sure admin databas,"Avoid Storing Data Inside ""Admin"" When Using MongoDB",Live,819
823,ibm dashdb allow hoc queri cloudant sql wareh predict analyt,Keeping data warehouse infrastructure out of your way,Live,820
824,scienc experi help work jupyt notebook rstudio local environ cloud work pick projects…,Using RStudio in IBM Data Science Experience,Live,821
825,sep mark version cloudant librari librari come plug aliv default,Plug-In to the Cloudant Node.js Library v1.5,Live,822
826,node red tool wire hardwar devic api onlin servic interest way,Node-RED,Live,823
827,video demo code walkthrough ibm sampl mobil acm apparel app spencer hockeborn quickli show app work step setup bluemix integr cloudant databas user authent setup confir push notif,Code Walkthrough of IBM MobileFirst Platform on Bluemix Hosted Acme Apparel Application,Live,824
828,replic minor observ default fraudster churner synthet minor oversampl smote work creat synthet observ exist minor observ chawla,What is SMOTE in an imbalanced class setting (e.g. fraud detection)?,Live,825
829,articl secur restheart api ad authent role base access control enabl ssl encrypt,Building Secure Instant API's with RESTHeart and Compose,Live,826
830,video show add asset catalog,Add data assets to a catalog using IBM Data Catalog,Live,827
831,here’ week’ news scienc big,"This Week in Data Science (August 09, 2016)",Live,828
832,simpl pipe app move salesforc dashdb ibm cloud warehous salesforc dashdb kind analysi kind tool sql looker,"Analyzing Salesforce Data with Looker: A Salesforce BI solution with dashDB, Cloudant, and Looker",Live,829
833,set elasticsearch databas compos,Getting Started with Elasticsearch using Compose,Live,830
834,seri focus open sourc tool chain small busi explor histori reason dimension model case onlin video view analysi,Turn Small Data Into Smart Data. Part 1,Live,831
835,past coupl month team work steve trevathan gregor martynu neighbourhoodi demo mobil web app app call voic interconnect,Voice of InterConnect – IBM Watson Data Lab,Live,832
836,decis fatigu prone bia individu organ bigger decis complex input greater consequ failure…,Machine Learning and the Science of Choosing,Live,833
837,reaction verg interview phil schiller upcom chang appl app store,App Store gives hope to Indie Developers Again?,Live,834
838,build sql queri scala notebook ibm analyt apach spark,Build SQL Queries in a Scala notebook using Apache Spark,Live,835
839,here’ week’ news scienc big,"This Week in Data Science (October 05, 2016)",Live,836
840,joshua drake founder unit state postgresql spi postgresql liaison chair pgconf largest postgresql confer north america talk compos datalay confer,The Center of Your Data Universe,Live,837
841,look basic cloud databas seri compos ibm cloud enter etcd,Seven Databases in Seven Days – Day 5: etcd,Live,838
842,configur dashdb connect cogno busi creat stun visual,Leverage dashDB in Cognos Business Intelligence,Live,839
843,cloudant curl interact cloudant http api acurl tool allow interact cloudant have enter usernam password request,"Authorized curl, a.k.a acurl",Live,840
844,cloudant document locat support resourc,Access Documentation and Support Resources,Live,841
845,adapt simpl sql support silverlin npm modul work browser databas pouchdb,Querying Your PouchDB Database with SQL – IBM Watson Data Lab – Medium,Live,842
846,statist difficult cours that’ actual scienc scienc doesn’t mean couldn’t smart determin enough…,Aspiring Data Scientists! Start to learn Statistics with these 6 books!,Live,843
847,python notebook easi access filter refin cloudant ibm analyt apach spark,Use the Cloudant-Spark connector in Python notebook,Live,844
848,mongodb index minim simpl feed record elasticsearch secondari databas databas tune effici transact secondari databas tunabl speedi complex comprehens search,Optimizing MongoDB Queries with Elasticsearch,Live,845
849,spark i’v work add pearson correl aggreg function sparksql aggreg function express sparksql,Pearson correlation aggregation on SparkSQL,Live,846
850,nosql product ibm recap talk nosql includ detail infrastructur model type databas avail today ibm cloud,Navigating NoSQL,Live,847
