,doc_description,doc_full_name,doc_status,article_id
0,detect bad read real python stream analyt,Detect Malfunctioning IoT Sensors with Streaming Analytics,Live,0
1,forest tree lie challeng perform present analysi scientist analyst engin face fulfil busi obj…,Communicating data science: A guide to presenting your work,Live,1
2,here’ week’ news scienc big,"This Week in Data Science (April 18, 2017)",Live,2
3,distribut db solv problem scale persist storag introduc latenc size increas bound,DataLayer Conference: Boost the performance of your distributed database,Live,3
4,video demonstr power ibm datasci experi simpl york state restaur inspect scenario,Analyze NY Restaurant data using Spark in DSX,Live,4
5,compos postgresql browser,Browsing PostgreSQL Data with Compose,Live,5
6,upgrad postgresql deploy version possibl compos consol work perform upgrad safe reliabl interest process version postgresql major upgrad,Upgrading your PostgreSQL to 9.5,Live,6
7,compani slack strive driven possibl understand user product essenti engin team slack work provid ecosystem to…,Data Wrangling at Slack,Live,7
8,kaggl home scienc skill build career collabor scientist compet world class challeng,Data Science Bowl 2017,Live,8
9,version post appear o’reilli radar o’reilli podcast fang scienc secur unsupervis apach spark subscrib o’reilly…,Using Apache Spark to predict attack vectors among billions of users and trillions of events,Live,9
10,appl sampl app food tracker taught io sync devic cloud offlin design,Offline-First iOS Apps with Swift & Cloudant Sync; Part 1: The Datastore,Live,10
11,replic relat dashdb databas greatli enhanc option analyz addit abil queri warehous sql power statist languag analysi extend cloudant’ wareh capabl includ geojson document increas number mobil internet iot applic captur store geospati nosql databas provid cloudant geojson facto standard capabl enabl analysi reflect geospati aspect,Warehousing GeoJSON documents,Live,11
12,recip showcas analyz histor seri captur ibm watson iot platform jupyt notebook spark sql panda datafram pre instal matplotlib librari visual result,Timeseries Data Analysis of IoT events by using Jupyter Notebook,Live,12
13,there’ reason you’v hear scienc notebook late scientist high demand python program languag wide particular jupyter…,Bridging the Gap Between Python and Scala Jupyter Notebooks,Live,13
14,peopl lurk statist look retail shopper insur polici holder bank custom polit constitu can…,Got zip code data? Prep it for analytics. – IBM Watson Data Lab – Medium,Live,14
15,earli method integr naiv bay custom sink,Apache Spark™ 2.0: Extend Structured Streaming for Spark ML,Live,15
16,perform supervis predict model character gener error error obtain dataset differ,Higher-order Logistic Regression for Large Datasets,Live,16
17,consid mysql potenti compos databas wait arriv high avail solut work deliv compos user solut came form mysql innodb cluster,Compose for MySQL now for you,Live,17
18,easier build system today ubiqu cut edg open sourc tool tensorflow torch spark coupl the…,The Greatest Public Datasets for AI – Startup Grind,Live,18
19,metric maven seri compos scientist share databas featur tip trick code metric articl look mode round seri mean median mode,Finding the Mode in PostgreSQL,Live,19
20,use rstudio piec analysi notebook languag part analysi articl step process…,Working interactively with RStudio and notebooks in DSX,Live,20
21,you’r disservic don’t map nearli spatial compon custom locat crime elect result traffic incid point purchas infrastructure…,Mapping for Data Science with PixieDust and Mapbox – IBM Watson Data Lab – Medium,Live,21
22,introduc nosqlimport npm modul help import comma separ tab separ file json document store choic,Move CSVs into different JSON doc stores,Live,22
23,video show build queri cloudant geospati index map cloudant dashboard,Tutorial: How to build and query a Cloudant geospatial index,Live,23
24,botkit provid simpl framework handl basic creat chat applic follow exampl toy app carri,The Conversational Interface is the New Paradigm,Live,24
25,creat scienc experi interview hundr scientist analyz think,Creating the Data Science Experience,Live,25
26,drive spent stuck traffic look park product googl map waze long stand goal help peopl navig road easili effici wasn’t tool address common park woe,Using Machine Learning to predict parking difficulty,Live,26
27,talk assum basic understand spark take standard intro explor make pyspark fast best scale pyspark job python spark faster job talk,Getting The Best Performance With PySpark,Live,27
28,paper propos gcforest decis tree ensembl approach perform highli com petit deep neural network,Deep Forest: Towards An Alternative to Deep Neural Networks,Live,28
29,i’m happi proud announc ibm non academ supplier offer scienc cours coursera we’v work hard cours great experi for…,Experience IoT with Coursera,Live,29
30,open api avail internet free review growth api economi organ realiz potenti open api transform busi,How open API economy accelerates the growth of big data and analytics,Live,30
31,video show sign free trial ibm scienc experi dsx,Sign up for a free trial in DSX,Live,31
32,stack ensembl techniqu combin inform multipl predict model gener time stack outperform individu mo…,A Kaggler's Guide to Model Stacking in Practice,Live,32
33,analyt visual hand hand great notebook ipython jupyt provid singl interfac numer analysi technolog brunel notebook natur fit exampl wide varieti python librari cleans shape analyz data–and brunel visual result,Using Brunel in IPython/Jupyter Notebooks,Live,33
34,extend aspect daili life handi simpli memor set exampl impact certain industri instanc we…,Top 10 Machine Learning Use Cases: Part 1,Live,34
35,articl i’ll app built help reddit game learn process i’ll share code tri,Gaze Into My Reddit Crystal Ball – IBM Watson Data Lab – Medium,Live,35
36,here’ quick handi guid creat visual appropri detail ensur maximum effect,Data visualization playbook: The right level of detail,Live,36
37,customis cloudant domain cloudfar better perform ddo protect cach here’ set,Create a Custom Domain for Cloudant Using Cloudflare – IBM Watson Data Lab,Live,37
38,guid cloudant doc endpoint retriev document rang key interact tutori,For Developers: Querying the Cloudant Primary Index,Live,38
39,app simpl display price histori serv foundat complic work discuss app complet post outset crucial note notebook serv differ purpos previou notebook,Pulling and Displaying ETF Data,Live,39
40,ensembl help improv result combin model ensembl method allow product better predict perform compar singl,Ensemble Learning to Improve Machine Learning Results,Live,40
41,easi custom mongo shell prompt especi mongodb shell mongohq elast deploy,Customizing MongoDB’s Shell with Compact Prompts,Live,41
42,get start scylladb easi drop replac apach cassandra databas,Getting Started with Compose's ScyllaDB,Live,42
43,free deep tensorflow cours provid solid introduct tensorflow analyz unstructur,Deep Learning With Tensorflow Course by Big Data University,Live,43
44,ibm bluemix simpl pipe exampl app conduct stack overflow analysi user support certain tech product,Uncover Product Insights Hidden in Stack Overflow,Live,44
45,build custom librari apache® spark™ deploy jupyt notebook,Start Developing with Spark and Notebooks,Live,45
46,rethinkdb push updat make great real app exampl built live session confer rethinkdb changefe,Q&A Voting App with RethinkDB,Live,46
47,watch download instal databas convers workbench studio plugin ibm dashdb,Install IBM Database Conversion Workbench,Live,47
48,ibm scienc experi,Data Science Experience Documentation,Live,48
49,look postgi filter place intersect chosen polygon,GeoFile: Using OpenStreetMap Data in Compose PostgreSQL - Part II,Live,49
50,commun detect scale,Graph-based machine learning,Live,50
51,landscap practic concis overview modern algorithm plu discuss tradeoff,Modern Machine Learning Algorithms,Live,51
52,watch build storefront web app ibm graph,Build an app using IBM Graph,Live,52
53,start today user abl access stream design watson platform stream design brand ide build applic real,Introducing Streams Designer,Live,53
54,discov way apach spark’ capabl drive modern busi,8 ways to turn data into value with Apache Spark machine learning,Live,54
55,build apach spark mllib predict flight delay weather past perform,"Predict Flight Delays with Apache Spark MLLib, FlightStats, and Weather Data",Live,55
56,easili add autocomplet web form field simpli upload set cloud servic fast effici autocomplet api,Introducing the Simple Autocomplete Service,Live,56
57,work explor improv vanilla regress knowledg learn,Transfer Learning for Flight Delay Prediction via Variational Autoencoders,Live,57
58,holden karau ibm visit thecub updat spark hardcor spark develop main stream,Advancements in the Spark Community,Live,58
59,let’ gift flight ride chopper spi jame bond movi given the…,How to tame the valley — Hessian-free hacks for optimizing large #NeuralNetworks – Autonomous Agents — #AI,Live,59
60,readr avail cran readr make easi read type rectangular includ csv tsv fix width file compar base equival readr mu…,readr 1.0.0,Live,60
61,postgresql probabl familiar common aggreg function count sum min max avg familiar window function tout advanc featur window function aren nearli esoter dive,Metrics Maven: Window Functions in PostgreSQL,Live,61
62,includ inform neutral visualization—and messag,Data visualization: The importance of excluding unnecessary details,Live,62
63,postgresql powerhous sql driven databas power compos postgresql power compos cloud deploy har power creat user access databas,Compose PostgreSQL: Making users and more,Live,63
64,open open sourc analyt allow commun stakehold action object research step explor feasibl forecast neighborhood chang longitudin censu legaci citi,Predicting gentrification using longitudinal census data,Live,64
65,you’r ibm custom busi partner you’v probabl heard company’ interconnect confer you’r unfamiliar ibm interconnect huge confer mandalay bay las…,InterConnect with us,Live,65
66,happi introduc sampl app call cloudant foodtrack demonstr build offlin app cloudant sync io,Introducing Cloudant FoodTracker: An Offline-First App,Live,66
67,job develop advoc ibm mean play databas live awesom thing invent serious travel spent mongodb,Find Mongo Document By ID Using The PHP Library,Live,67
68,introductori overview numpi foundat aspect scientif comput python explan math involv,An Introduction to Scientific Python (and a Bit of the Maths Behind It) – NumPy,Live,68
69,figur calcul move averag bit daunt method cover easi use track report,Metrics Maven:  Calculating a Moving Average in PostgreSQL,Live,69
70,bradley holt ibm cloudant web mobil app shouldn stop work network connect apach couchdb pouchdb open sourc,Offline-First Apps with PouchDB,Live,70
71,tutori creat web track app work dynam gener element use cloudant ibm bluemix,Simple Metrics Tutorial Part 1: Metrics Collection -- Code a web analytics app with Node.js and IBM Cloudant,Live,71
72,year ago ask postgresql json postgresql check betteridg law appli talk jsonb support postgresql,Could PostgreSQL 9.5 be your next JSON database?,Live,72
73,here’ week’ news scienc big,"This Week in Data Science (September 27, 2016)",Live,73
74,“what live question pretti clear answer “i’m scientist late it’ gotten complicated…,The 3 Kinds of Context: Machine Learning and the Art of the Frame,Live,74
75,video provid tour commun section ibm scienc experi,Tour the Community in DSX,Live,75
76,here’ week’ news scienc big,"This Week in Data Science (May 2, 2017)",Live,76
77,sum facebook offer cover broad spectrum analyt space continu interact open sourc commun order share experi,Apache Spark @Scale: A 60 TB+ production use case,Live,77
78,here’ week’ news scienc big,"This Week in Data Science (May 16, 2017)",Live,78
79,cloudant geospati index real world applic,Tutorial: How to Cloudant Geospatial in Action,Live,79
80,post discuss implement apple’ core platform dsx announc day ago wwdc core platform allow integr power pre trained…,Leverage Scikit-Learn Models with Core ML,Live,80
81,cooper approach gener entiti vector,Transform anything into a vector,Live,81
82,video show creat save deploy logist regress ibm waston ibm scienc experi assess likelihood custom outdoor equip compani buy tent age sex marit statu job profess,Build a logistic regression model with WML & DSX,Live,82
83,today proud announc janusgraph come compos bring power fulli open sourc graph databas,Compose's first graph database: JanusGraph,Live,83
84,watch easi consum twitter ibm dashdb analyt,Tutorial: How to load Twitter data in IBM dashDB ,Live,84
85,testthat avail cran testthat make easi turn exist inform test formal autom test rerun quickli easili instal lat…,testthat 1.0.0,Live,85
86,mean median mode metric provid valuabl insight articl deepli familiar highlight key consider understand contribut number report,Metrics Maven: Beyond Average,Live,86
87,here’ week’ news scienc big,"This Week in Data Science (July 26, 2016)",Live,87
88,metric collector app rebuilt fit microservic stack,Simple Metrics Collector Microservices Edition,Live,88
89,cran packag repositori featur activ packag analysi,Top 20 R Machine Learning and Data Science packages,Live,89
90,pleas announc enabl import mongodb compos,New Import for Compose MongoDB,Live,90
91,websit engag track techniqu allow busi part websit user visit click view articl look track user engag elasticsearch compos,Website Engagement Tracking with Elasticsearch,Live,91
92,wish begin career scienc save day week month frustrat avoid costli beginn mistak,9 Mistakes to Avoid When Starting Your Career in Data Science,Live,92
93,read standard php applic deploy bluemix,Deploy Your PHP Application to Bluemix,Live,93
94,armand ruiz gabernet armand ruiz lead product manag ibm scienc experi ibm sit dave vellant jeff frick thecub,"Armand Ruiz Gabernet, IBM - BigDataNYC #BigDataNYC 2016 #theCUBE",Live,94
95,fifth releas weekli round interest scienc big news link upcom event,"This Week in Data Science (December 20, 2016)",Live,95
96,discov open sourc platform combin process power spark power algorithm,Improving quality of life with Spark-empowered machine learning,Live,96
97,thirti ninth releas weekli round interest scienc big news link upcom event,"This Week in Data Science (November 08, 2016)",Live,97
98,sign visual,How to map USA rivers using ggplot2,Live,98
99,look basic cloud databas seri run compos intro programmat access enter mongodb php,Seven Databases in Seven Days – Day 2: MongoDB,Live,99
100,video show add asset exist project load analyt python notebook,Use data assets in a project using IBM Data Catalog,Live,100
101,project great master scienc choos project care articl tip choos project appropri skill level tell pitfal watch scienc tutori sign email list,How to choose a project to practice data science,Live,101
102,decis didn’t mean patienc look help choos best option ye you’r score,How to ease the strain as your data volumes rise,Live,102
103,sean loppat rstudio work compani interest scale typic scale big big comput scale grow team scientist post provid framework answer big big computationth step,How to Scale Your Analytics Using R,Live,103
104,fortieth releas weekli round interest scienc big news link upcom event,"This Week in Data Science (November 15, 2016)",Live,104
105,summari progress web app recommend refactor code offlin storag aspect pwa,"Building Offline-First, Progressive Web Apps",Live,105
106,redund visual turn good thing obscur connect diminish contrast,Data visualization: Function drives design,Live,106
107,enhanc product,When machine learning matters · Erik Bernhardsson,Live,107
108,creat notebook ibm scienc experi pixiedust explor visual differ way chart map simpl,"Using Notebooks with PixieDust for Fast, Flexible, and Easier Data Analysis and Experimentation",Live,108
109,weekli newslett latest develop deep,TensorFlow Quick Tips,Live,109
110,open sourc helper librari jupyt python notebook easier viz export packag manag scala context python,PixieDust: Magic for Your Python Notebook,Live,110
111,script extern packag jupyt notebook facilit code organ larger project,Tidy up your Jupyter notebooks with scripts,Live,111
112,apach systemml demo systemml,Building Custom Machine Learning Algorithms With Apache SystemML,Live,112
113,here’ week’ news scienc big,"This Week in Data Science (February 28, 2017)",Live,113
114,loren sand ramshaw author graphql rest show combin multipl sourc graphql write stuff seri,Use all the Databases,Live,114
115,ibm design team began research scientist disciplin common,Finding the user in data science,Live,115
116,tutori complet concept random forest bag explain,Practical Tutorial on Random Forest and Parameter Tuning in R,Live,116
117,post provid brief summari sampl code chang migrat java applic apach sparktm apach sparktm migrat effort depend apach sparktm api given applic use,Apache Spark™ 2.0: Migrating Applications,Live,117
118,preschool loyal compos custom incept mission preschool access practic world spoke founder chri bennett arrel gray hear startup technolog stack mission,Making the Most of Compose - Customer One Preschool,Live,118
119,run spark batch job programmat exampl scala python launch hello world spark job spark submit,Launch a Spark job using spark-submit,Live,119
120,revolut underway chang industri deliv outcom unimagin year ago video john thomas’ keynot apachecon,A Dynamic Duo – Inside Machine learning – Medium,Live,120
121,question hear sql databas nosql databas question get ask underli question broken sql databas nosql databas fix answer easier,Picking SQL or NoSQL? – A Compose View,Live,121
122,instal seri post aim introduc develop basic concept tool requir run,Watson Machine Learning for Developers,Live,122
123,choos databas technolog app choic overwhelm consid graph databas,What's all the hoopla about graph databases?,Live,123
124,studi design algorithm hope disciplin bring inclus experi task eventu improv the…,Python Machine Learning: Scikit-Learn Tutorial,Live,124
125,muse scienc softwar engin time econom,Statistics for Hackers,Live,125
126,join rethinkdb document databas,RethinkDB Joinery,Live,126
127,meteor databas driver couchdb cloudant,cloudant/meteor-couchdb,Live,127
128,cloudant search apach lucen allow facet aggreg count search process facet allow custom drill search result filter power intuit,Search Faceting from Scratch [Tutorial],Live,128
129,sasko stubailo meteor explain graphql manag problem solv organ tri today,DataLayer Conference: Translating Backend Data to Frontend Needs,Live,129
130,featur import exampl python xgboost get better perform featur prune,Feature importance and why it's important,Live,130
131,articl follow previou articl analyz python build basic intro ipython notebook panda visual process tool,Simple Graphing with IPython and Pandas,Live,131
132,python cheat sheet specif start scienc extra help work scienc problem,Collecting Data Science Cheat Sheets,Live,132
133,releas elasticsearch came painless elasticsearch answer safe secur perform script introduc painless,How to Script Painless-ly in Elasticsearch,Live,133
134,thirti eighth releas weekli round interest scienc big news link upcom event,"This Week in Data Science (November 01, 2016)",Live,134
135,follow couchdb latest releas couchdb cloudant databas,Simple CouchDB and Cloudant Backup,Live,135
136,here’ week’ news scienc big,"This Week in Data Science (February 7, 2017)",Live,136
137,video show execut common http api command creat read updat delet cloudant databas,Execute Common HTTP API Commands,Live,137
138,dplyr amaz packag manipul fun packag strength dplyr eleg resembl natur languag succinct,Best packages for data manipulation in R,Live,138
139,gigi sayfan take cassandra scylla mysql redi compos write stuff articl show construct moneybal,Designing the UFC Moneyball,Live,139
140,video datalay confer featur emil baizel digit,Emile Baizel & Building a Fintech Bot on MongoDB and Elasticsearch,Live,140
141,analysi option simpl pipe cloudant connect couchdb analyz json sparkr jupyt notebook,Reddit sentiment analysis in SparkR and CouchDB,Live,141
142,introduct neural network beginn main challeng work neural network popular type applic,Neural networks for beginners: popular types and applications,Live,142
143,understand scala better sat jakob oderski real life bonafid scala expert ask serious scala question,0 to Life-Changing App: Scala First Steps and an Interview with Jakob Odersky,Live,143
144,second releas weekli round interest scienc big news link upcom event,"This Week in Data Science (July 12, 2016)",Live,144
145,recent we’v seen danger make decis incomplet poor play world stage prime minist call gener elect year earlier than…,Don’t throw more data at the problem! Here’s how to unlock true value from your data lake,Live,145
146,heard warehous cloud relat databas choic dsx today i’m happi announc featur make easier,How to use Db2 Warehouse on Cloud in Data Science Experience notebooks,Live,146
147,build collect app captur store code network unavail,Offline-first QR-code Badge Scanner,Live,147
148,search slack account ibm graph databas watson alchemyapi,Search Slack with IBM Graph,Live,148
149,easi unlock mobil web applic flexibl analysi report bluemix secur gateway servic let premis cloud secur manner,ibm-cds-labs/hybrid-cloud-tutorial,Live,149
150,campu discount use compos host databas includ mysql mongodb redi elasticsearch rabbitmq power social media platform recent start explor ibm watson add cognit featur app sat founder cto omondi hear stori,Campus Discounts - Making the Most of Compose (customer),Live,150
151,scienc way scienc build portfolio elabor pet project quick explor task…,Jupyter Notebook Tutorial,Live,151
152,lead hundr project year gain advic team unit state wrote post explain build solut solv problem one mention,How to solve 90% of NLP problems,Live,152
153,seri wrote goal explor case platform build classif model platform predict…,"Predicting Flight Cancellations Using Weather Data, Part 3",Live,153
154,watch quick easi perform analyt dashdb tableau,Use dashDB with Tableau,Live,154
155,articl walk calcul exponenti weight move averag,Metrics Maven: Calculating an Exponentially Weighted Moving Average in PostgreSQL,Live,155
156,jona helfer meteor discuss join databas graphql,DataLayer Exposed: Jonas Helfer & Joins Across Databases with GraphQL,Live,156
157,approach select featur statistician statistician sibl pov paper subject overview approach,Data Science of Variable Selection,Live,157
158,we’r pleas announc packag generating interact heat map using  and htmlwidget tal galili author dendextend collabor packag,d3heatmap: Interactive heat maps,Live,158
159,prepar seti institute’ hackathon code challeng citizen scientist arun ramamoorthi research arizona state univers look the…,Citizen Scientist finds “Death Star” in SETI data set,Live,159
160,locat tracker exampl app show simpl cloudant swift geojson offlin scale databas user pattern,Location Tracker – Part 2,Live,160
161,spark program ibm analyt apach spark ibm bluemix,Use the Machine Learning Library in Spark,Live,161
162,post seri stock analysi post basic obtain yahoo financ panda visual stock move averag develop move averag crossov strategi backtest benchmark cover,An Introduction to Stock Market Data Analysis with R (Part 1),Live,162
163,option power compos portal recent introduc featur delet deploy easier work compos note tell,Portal Powerups and Deleted Deployments,Live,163
164,articl discuss deep approach recommend tensorflow deep,Learn TensorFlow and Deep Learning Together and Now!,Live,164
165,classcraft gamifi classroom experi make educ fun adventur student teacher chat shawn young teacher programm founder classcraft studio teach platform built compos mongodb elasticsearch,Making the Most of Compose – Customer: Classcraft,Live,165
166,omondi demonstr leverag compos mongodb send effect push notif,Push Notifications With MongoDB,Live,166
167,cloudant local bring cloudant nosql databas custom regulatori restrict difficult cloud,Introducing Cloudant Local,Live,167
168,python jupyt notebook,Node.js data science notebooks – IBM Watson Data Lab – Medium,Live,168
169,rethinkdb databas compos avail forese futur,RethinkDB and Compose,Live,169
170,dougla mason scientist twitter “what carri me…wa relentless enthusiasm i’m certain key success lead current role scientist,Got a PhD? Struggling To Be a Data Scientist?,Live,170
171,earlier year rethinkdb releas fantasia version articl go closer look lesser known featur came releas aggreg fold command,Deeper into RethinkDB 2.3,Live,171
172,import cloud sourc choic connector load varieti sourc simpl pipe cloudant,Simple Data Pipe Connectors,Live,172
173,technolog advanc method design effect busi progress tool emerg scienc confer discov latest trend field but…,"10 Must Attend Data Science, ML and AI Conferences in 2018",Live,173
174,quickli creat facet search api app open sourc code cloudant redi ibm cd develop advocaci team,Introducing the Simple Search Service: Faceted search API made easy,Live,174
175,peopl word code you’r poem gener project don’t necessarili applic creat poem user using…,A Way with Words and Code – IBM Watson Data Lab – Medium,Live,175
176,join look what’ horizon analyt discov broad array tool aim chang do—and think about—data scienc,Top analytics tools in 2016,Live,176
177,openwhisk make easi deploy microservic elimin manag messag broker deploy worker server,Introducing OpenWhisk: Microservices Made Easy,Live,177
