,doc_description,doc_full_name,doc_status,article_id
515,cloudant highli avail partit toler distribut databas eventu consist cap theorem blog outlin techniqu deal eventu consist practic,Coding for Eventual Consistency,Live,514
516,spark stream batch stateless design transform batch affect rdd batch result applic effect free run applic infinit number time result behavior similar function program simplifi debug reason state program path determinist,The Art of Side Effects: Curing Apache Spark Streaming’s Amnesia (Part 1/2),Live,515
517,life spreadsheet csv,Simple CSV Import For CouchDB – IBM Watson Data Lab – Medium,Live,516
518,video show quick start load local file shape,Shaping data with IBM Data Refinery,Live,517
519,build warehous isn scari sound exampl app let automat load json dashdb ibm cloud warehous servic,Cloud Data Warehouse Made Easy,Live,518
520,offlin app let mobil util worker access updat mainten detail map disconnect,Better infrastructure maintenance with offline mobile maps,Live,519
521,redi brought redi lua debugg quick look,Debugging Lua in Redis,Live,520
522,unleash power analyt cognit ibm world watson octob la vega explor scienc relat present lab world watson hear…,Learn about Data Science in World of Watson,Live,521
523,previous learn creat custom visual pixiedust visual code written test directli notebook cell great proof concept and…,Share the (PixieDust) Magic – IBM Watson Data Lab – Medium,Live,522
524,scale web app success microservic ibm messag hub handl user grow volum,Scale a Web App with Microservices and IBM Message Hub,Live,523
525,it’ wide understood organ emb analyt scienc oper model bring action knowledg busi decis busi are…,Data science platforms are on the rise and IBM is leading the way,Live,524
526,we’v ad tool easier shini video tutori start shini video provid teach shini video cover every…,New Shiny cheat sheet and video tutorial,Live,525
527,use compos mongodb postgresql jsoniq demonstr video,A guest video post,Live,526
528,think move etcd etcd chang expect,A How-to for migrating from etcd 2 to etcd 3,Live,527
529,jupyt notebook ipython notebook brilliant code tool ideal reproduc research list tip structur jupyt notebook,10 tips on using Jupyter Notebook,Live,528
530,video show creat project associ project catalog add catalog project,Create a project and add data using IBM Data Refinery,Live,529
531,nifi provid servic necessari nice flow tool plu provid servic easili customiz class processor mongodb,What You Need to Know to Extend NiFi,Live,530
532,recap oscon europ joey lynch excel talk build power tier open sourc datastor,OSCON Europe Talk Review,Live,531
533,thank great experiment work research group studi behavior stochast gradient descent sgd collect gain clearer understand happen neighborhood converg,The Two Phases of Gradient Descent in Deep Learning,Live,532
534,visual easi faith trust pixiedust,"Move over, MatPlotLib – IBM Watson Data Lab – Medium",Live,533
535,dplyr big releas heap featur bunch minor improv bug fix broader dplyr commun blog post you’ll highlight import chang,dplyr 0.5.0,Live,534
536,cover mobil internet iot case deep dive offlin explor pattern pouchdb cloudant includ set databas user databas devic read replic write replic come prepar offlin question,A Deep Dive into Offline First with PouchDB and IBM Cloudant,Live,535
537,bluemix rich report author environ creat visual chart format list tutori show creat pedomet app liberti java combin dashdb mongolab embedd report servic bluemix,Embed rich reports in your applications,Live,536
538,run postgresql compos postgi upgrad pgrout avail,Compose PostgreSQL powers up to 9.6,Live,537
539,set cloudant replic job programmat,Use cURL to set up replication,Live,538
540,cloud wareh analysi we’ll walk oracl cloud dashdb warehous,Convert data from Oracle to dashDB,Live,539
541,analysi solut appli simpl pipe easi cloudant json dashdb warehous built analysi tool glean mean insight,Sentiment Analysis of Reddit AMAs using dashDB and R,Live,540
542,continu bring video session year datalay confer ross kukulinski talk state state contain,DataLayer Exposed: Ross Kukulinski & The State Of State In Containers,Live,541
543,book intend work intend develop python applic applic develop consult softwar architect scientist instructor student good refer dev op administr product manag,Getting started with Python,Live,542
544,news esri arcgi desktop onlin open offer softwar combin koop cloudant dashdb,IBM Analytics at the Esri Partner/Developer Summit,Live,543
545,packag let beauti customiz plot implement grammar graphic easi build plot,Data Visualization with ggplot2 Cheat Sheet,Live,544
546,love contain play kubernet excit ibm offer kubernet ibm bluemix contain servic note write this…,Zero to Kubernetes on the IBM Bluemix Container Service,Live,545
547,cloudant traffic tamer app collect car telemetri car stop event synchron cloudant enabl crowd sourc traffic inform post describ pouchdb collect offlin sync cloudant network,Syncing Car Telemetry Data in Real-Time: Ford’s OpenXC API and Cloudant’s Traffic Tamer App,Live,546
548,trust funni thing day you’r world right recent elect obvious shaken trust analyt establish reasons…,Trust in Data Science,Live,547
549,video compos datalay confer,"DataLayer Conference: Scylla, the High-Performance Cassandra-Successor",Live,548
550,fourth releas weekli round interest scienc big news link upcom event,"This Week in Data Science (December 13, 2016)",Live,549
551,articl build quick easi signup form node red allow user enter inform save enter compos mongodb databas look valid case email address handl valid error,5-minute Signup Forms with Node-RED and Compose,Live,550
552,talk long compos user vikram tiwari omni lab present compani bootstrap compos,DataLayer Conference: Bootstrapping a Startup using Compose,Live,551
553,develop io app swift ibm cloudant post demonstr element offlin design pull sync replic spinner,Offline-First iOS Apps with Swift & Cloudant Sync; Part 3,Live,552
554,basic concept intuit differ kind algorithm differ task,Which One to Choose for Your Problem,Live,553
555,week end februari rethinkdb home redi futur map postgresql featur appear,"RethinkDB lives, Redis and PostgreSQL futures, FOSDEM, Rust and Wuzz",Live,554
556,watch video build naiv bay ibm waston ibm scienc experi assess categori good custom interest,Build a Naive-Bayes Model with WML & DSX,Live,555
557,introduc silverlin librari hide away power esoter function cloudant concentr make manipul simpl intuit user,Cloudant and Node.js Made Simple with the silverlining Library – IBM Watson Data Lab,Live,556
558,work spark engin oper shape prepar analysi includ augment exist,Let's have some fun with NFL data,Live,557
559,mongo metric seri collabor compos resid scientist lisa smith show extract insight toy store compos mongodb seri mongodb flavor popular metric maven seri,Mongo Metrics: Calculating the Mean,Live,558
560,here’ week’ news scienc big,"This Week in Data Science (April 4, 2017)",Live,559
561,load cloudant ibm analyt apach spark cloudant spark connector scala notebook,Load Cloudant Data in Apache Spark Using a Scala Notebook,Live,560
562,video show set pre authent version curl elimin type usernam password execut curl command act cloudant databas,Set Up Pre Authenticated cURL,Live,561
563,bluemix connect load mix refin raw premis premis environ,Data Connect: Cloud data prep and movement,Live,562
564,rstudio ide popular integr develop environ write run debug code work collabor project version control build packag creat document app matter rstudio ide help faster cheat sheet guid use featur ide long list keyboard shortcut built rstudio ide,RStudio IDE  Cheat Sheet,Live,563
565,happi announc packag avail cran is an interfac javascript librari datatables bas the htmlwidgets framework present rectangular objects…,DT: An R interface to the DataTables library,Live,564
566,ad featur bach command line compos api easier track complet explain watch wait advic command line user api develop,How to watch and wait with Compose's Bach and API,Live,565
567,post look probabl distribut encount scienc statist,The t-distribution: a key statistical concept discovered by a beer brewery,Live,566
568,failur appreci govern come lack understand valu deliv import futur success,You could be looking at it all wrong,Live,567
569,build end io mobil app bluemix cloudant you’ll configur authent facebook implement cloud storag sync mobil app set push notif,Build an iOS 8 App with Bluemix and the MobileFirst Platform for            iOS,Live,568
570,ask social influenc scientist collabor build better busi applic,How can data scientists collaborate to build better business,Live,569
571,hard visual exactli closet shelv fit live quarter organ live turn compos custom differenti build easi visual tool,Making the Most of Compose – Case Study: Differential,Live,570
572,articl go look node connect elasticsearch deploy index document perform simpl text search,Getting started with Elasticsearch and Node.js - part 1,Live,571
573,recent return offlin camp berlin offlin camp funni thing happen offlin camp date inevit stream tweet come offline…,Offline First: What’s in a name? – IBM Watson Data Lab,Live,572
574,blog look move amazon dynamodb cloudant couchdb articl we’r go look extract microsoft azure’ documentdb servic tool makes…,Moving data from DocumentDB to Cloudant or CouchDB – IBM Watson Data Lab,Live,573
575,final step seri creat web applic access elasticsearch manag host web app ibm bluemix,Getting started with Elasticsearch and Node.js - part 5,Live,574
576,lodgiq cto somnath banerje bring dynam scienc hospit industri platform built apach spark,The New Builders Ep. 13: All the Data That’s Fit to Analyze,Live,575
577,previou life particl physicist search rare nuclear reaction order count neutrino sun search dark matter forgotten recently…,Offline and radioactively clean – IBM Watson Data Lab – Medium,Live,576
578,video show construct queri access primari index cloudant api,Use the Primary Index,Live,577
579,combin custom sale open set censu stat perform analysi cloud driven busi decis,Data-Driven Shopper Insights,Live,578
580,thing divers consult firm agre they’v right mix databas manag databas servic compos,Why IT Consulting and Developer Services Companies Love Compose,Live,579
581,transport develop origin synchron mongodb databas articl look configur latest gener transport,"Transporter, MongoDB and synchronization",Live,580
582,geofil seri dedic look geograph featur use today articl go convert osm geojson import compos mongodb deploy,GeoFile: How to Transform OpenStreetMap Data into GeoJSON Using GDAL,Live,581
583,we’r proud announc version tibbl packag tibbl modern reimagin frame keep shown effect throw grab la…,tibble 1.1,Live,582
584,grip organization’ cdo need compani isn simpl,The million dollar question: Where is my data?,Live,583
585,releas weekli round interest scienc big news link upcom event,"This Week in Data Science (December 06, 2016)",Live,584
586,you’r r’ tidyvers packag it’ import break small unit master essenti function isol unit mind we’ll small project put,Tidyverse practice: mapping large European cities,Live,585
587,o’reilli podcast eric colson algorithm human comput build scienc team version post appear o’reilli radar subscrib,Building a business that combines human experts and data science,Live,586
588,appl food tracker sampl app taught io sync cloud offlin design cover cloud json sync,Offline-First iOS Apps with Swift & Cloudant Sync; Part 2,Live,587
589,announc tidyr tidyr make easi “tidy” store consist form it’ easi manipul visualis tidi simpl convention…,tidyr 0.6.0,Live,588
590,fli donut creat simpl intuit agil collabor project track tool run compos mongodb rabbitmq,Making the Most of Compose – Customer: Flying Donut,Live,589
591,icanmakeitbett mix elixir languag compos mongodb databas key compon stack power compani market research platform,Making the Most of Compose - Customer icanmakeitbetter,Live,590
592,claudiu barri wark talk life scienc softwar use cloudant store biolog chemic experiment,Using NoSQL DBaaS to launch Life Science Software,Live,591
593,combin apache® spark™ cloud servic speed analysi reveal insight,Apache Spark Analytics,Live,592
594,scienc experi dsx unifi analyt environ provid access jupyt notebook rstudio ibm analyt apach spark think spark servic dsx tightly…,Upload Files to IBM Data Science Experience Using the Command Line,Live,593
595,analyz york citi traffic collis python notebook ibm analyt apach spark,NY Motor Vehicle Accident Analysis,Live,594
596,creat connect dashdb ibm analyt apach spark load scala notebook,Load dashDB Data with Apache Spark,Live,595
597,graham cox talk integr test live databas local compos manag deploy,Integration Testing Against Real Databases,Live,596
598,number datatyp avail postgresql articl go look array datatyp,Take a Dip into PostgreSQL Arrays,Live,597
599,go talk run kibana instanc elasticsearch think odd thing elasticsearch user pay attent elasticsearch restructur version compon move away central server plugin architectur given server,Kibana and Compose Elasticsearch,Live,598
600,black box random forest open track decis path tree comput featur contribut predict decompos contribut featur linear breakdown inher imperfect linear combin featur captur interact,Random forest interpretation – conditional feature contributions,Live,599
601,post ibm analyt apach spark servic rstudio ide integr scienc experi rstudio premier integrated…,Access IBM Analytics for Apache Spark from RStudio,Live,600
602,build platform mean build api build api mean manag key api effici kirk moral ceo hyver scylladb solv tricki problem,How Hyver uses ScyllaDB for API Key Management,Live,601
603,introduc odoo open sourc erp deploy odoo stack ibm bluemix contain servic compos postgresql provid layer,"Manage Your Business with Compose, Odoo, and Bluemix",Live,602
604,beauti apach couchdb cloudant don’t librari abl start databas requir “driver” modul instal handl commun between…,Choosing a Cloudant Library – IBM Watson Data Lab – Medium,Live,603
605,consid big sourc insight enhanc decis make best character cs—confid context choic,The 3 Cs of big data,Live,604
606,compos open sourc transport power tool articl upload mongodb databas unlock power transform,How to move data with Transporter - from disk to database,Live,605
607,week interest scienc link web collect scienc brief dataminingapp newslett,Web Picks (December 2017),Live,606
608,today compani big super relev recommend growth revenu varieti recommend algorithm scientist choos best accord,Recommendation System Algorithms – Stats and Bots,Live,607
609,compos quick peer jira issu repositori come branch develop januari version thought good look caught,A first peek at the next MongoDB,Live,608
610,articl demonstr bayesian method estim paramet simpl linear regress slr,Simple Linear Regression? Do It The Bayesian Way,Live,609
611,jupyt notebook provid effect develop document execut commun result tip trick life easier work notebook science…,Back to basics — Jupyter notebooks,Live,610
612,serverless program gener openwhisk particular action run respons event event web request databas chang sensor reading—th possibl are…,Trigger Periodic OpenWhisk Actions – IBM Watson Data Lab – Medium,Live,611
613,explor open sourc block chain technolog ethereum build smart contract help understand strength block chain platform,"Block chain technology, smart contracts and Ethereum",Live,612
614,we’v encapsul http api ibm graph databas servic avail open sourc librari help run faster java check simpl sampl app,Accessing IBM Graph from Java – IBM Watson Data Lab,Live,613
615,creat simpl gorgeou platform publish technic document run compos enterpris mongodb redi,Making the Most of Compose Enterprise – Customer: ReadMe.io,Live,614
616,offlin app cloudant sync deliv better ux—both offlin on—bi store local synch cloud connect,Offline-First mobile apps with IBM Cloudant,Live,615
617,let’ creat predict price home particular citi gather histor sale detail home sold proxim park income…,Three reasons machine learning models go out of sync,Live,616
618,month announc avail pixiedust commun adopt fantast repo star feedback confer event develop data…,PixieDust gets its first community-driven feature in 1.0.4,Live,617
619,power field’ research increasingli unabl account algorithm,Can A.I. Be Taught to Explain Itself?,Live,618
620,go look connect compos rethinkdb elixir pick pitfal,Connecting to RethinkDB with Elixir,Live,619
621,video introduc differ type index creat queri databas explain typic case type index,Define indexes and queries,Live,620
622,look basic cloud databas seri run compos intro programmat access enter postgresql,Seven Databases in Seven Days – Day 3: PostgreSQL,Live,621
623,today we’r excit announc htmlwidget framework bring best javascript data visual librari  there packag advantag th…,htmlwidgets: JavaScript data visualization for R,Live,622
624,compos redi browser,Redis Data Browser Now Available in Compose Dashboard,Live,623
625,develop come cloudant sql background lot question import schema authent post answer frequent ask question,Top 6 Questions from our webinar on Top 6 Questions about SQL -> NoSQL Migrations,Live,624
626,summari recent articl chatbot watson platform watson develop cloud dev advocaci teams — includ stori origin publish free code camp’ medium public,Have you had “The Talk” with your chatbot about graph data structures? – IBM Watson Data Lab,Live,625
627,video show connect ibm warehous cloud databas rstudio ibm scienc experi dsx,Analyze Db2 Warehouse on Cloud data in RStudio in DSX,Live,626
628,compos understand redi essenti cog oper minimis downtim migrat offer creat static import tool import remot redi instal compos redi deploy,Importing Redis data into Compose Redis,Live,627
629,cloudant dashdb integr offici beta gener avail don’t ibm dashdb cloud warehous built analyt tailor help ensur you’r make dashdb access right cloudant dashboard wareh tab,"Data Warehousing Features, Improvements, and Updates: Introducing the New DashDB",Live,628
630,video show cloudant dashboard creat databas add document databas easi json editor,Create a Database and Add Documents to Database,Live,629
631,best known mongodb desktop roof decid look work compos,Taking a Look at Robomongo and Studio 3T with Compose for MongoDB,Live,630
632,stori week scienc big,"This Week in Data Science (January 17, 2017)",Live,631
633,sven hafeneg ibm deliv lightn talk call hyperparamet optim scikit meet pyspark,Hyperparameter Optimization: Sven Hafeneger,Live,632
634,manag replic job cloudant,Check the status of a replication job,Live,633
635,optim analyt oper way warehous cloud known ibm dashdb excel choic home analyz science…,Working with Db2 Warehouse on Cloud in Data Science Experience,Live,634
636,cloudant couchdb dashboard develop team land substanti improv replic,UX Improvements to Cloudant Data-Replication,Live,635
637,thursday june mark year anniversari work stack overflow scientist i’d finish phd month join tech compani pretti big chang month earlier i’d plan stay academ research particularli field comput biolog i’d start appli postdoctor fellowship hadn’t consid appli “industry” job chang mind,One year as a Data Scientist at Stack Overflow,Live,636
638,creat dashdb instanc popul directli cloudant account,Load JSON from Cloudant database into dashDB,Live,637
639,articl look calcul weight averag appli group product hypothet pet suppli compani,Metrics Maven: Calculating a Weighted Average in PostgreSQL,Live,638
640,servic build tool track deploy sampl app ibm bluemix,Tracking Deployments of Sample Apps,Live,639
641,rl say secur row tabl enabl tabl plu commit databas role main secur mechan barrier reason featur,Row Level Security with PostgreSQL 9.5,Live,640
642,explor highli effect deep approach sentiment analysi tensorflow lstm network,"Perform sentiment analysis with LSTMs, using TensorFlow",Live,641
643,improv watson recip chatbot integr cloudant cach parti api call provid person run analyt interact,Persisting Data for a Smarter Chatbot,Live,642
644,analyz ibm biginsight cloud bigsheet big sql,BigInsights on Cloud for Analysts,Live,643
645,start build model python ibm scienc experi,H2O With IBM's Data Science Experience (DSX),Live,644
646,logist regress method fit regress curv categor variabl typic predict given,How to Perform a Logistic Regression in R,Live,645
647,import structur cloudant nosql databas index present facet search api,Importing Game of Thrones Data into Cloudant with the Simple Search Service,Live,646
648,apach mahout drop huge releas add support spark cpu gpu acceler nativ solver apach mahout linear algebra librari run distributed…,Getting started with Apache Mahout,Live,647
649,today month develop pleas introduc compos enterpris compos enterpris add option manag host dedic compos cluster featur compos encrypt rest control backup complianc secur,Compose Enterprise Reloaded,Live,648
650,comput notebook provid workspac programm scientist process visualis analys web page usual notebook code written python java scala,Analysing Cloudant JSON in RunKit JavaScript Notebooks – IBM Watson Data Lab,Live,649
651,articl we’ll continu discuss get locat radiu appli geojson document mongodb we’ll set indic mongodb’ built geospati queri oper,GeoFile: Everything in the Radius with MongoDB Geospatial Queries,Live,650
652,creat stream topic watson platform receiv divers sourc creat connect topic order analyz stream analytic…,Analyzing streaming Data from Kafka Topics,Live,651
653,review coupl scenario move nifi look simplest approach possibl queri insert brute forc approach poll duplic advanc synchron approach hook mongodb oplog,Mongo to Mongo Data Moves with NiFi,Live,652
654,video show creat connect sourc ibm refineri add connect project,Create a connection and add it to a project using IBM Data Refinery,Live,653
655,compos mongodb user haven worri problem worth look go isn worri,MongoDB and Ransomware,Live,654
656,watch video creat project ibm scienc experi dsx set watson wml,Create a project for Watson Machine Learning in DSX,Live,655
657,recent achiev deep past year bit longer we’ll tell signific develop affect futur,Deep Learning Achievements Over the Past Year ,Live,656
658,compos believ databas easi util servic home that’ databas compos platform manag servic,Why a managed database from Compose?,Live,657
659,blog deal show implement web analyt python,Automating web analytics through Python,Live,658
660,coupl month we’v blog challeng face organ today particularli area access collabor govern post present,"Discover, catalog and govern data with IBM Data Catalog",Live,659
661,set cloudant databas replic job,Create a replication job,Live,660
662,kdnugget editor bring answer question detect fake scientist includ regular scientist admir valid,21 Must-Know Data Science Interview Questions and Answers,Live,661
663,video show build deep popular set ibm watson neural network model,Build Deep Learning Architectures With Neural Network Modeler,Live,662
664,scienc practic amaz complex solo scientist form relev hypothesi correspond set clean repeatedli build edit prove disprov hypothesi,Find the User in Data Science ,Live,663
665,chri erwin share experi partial index postgresql talk incred power tool heard,DataLayer Conference: Partial Indexing for Improved Query Performance,Live,664
666,scienc hard harder check featur avail scienc experi help easier work team notebook,Get social with your notebooks in DSX,Live,665
667,connect dashdb sourc target databas servic cloud easi synchron,Integrate dashDB and Informatica Cloud,Live,666
668,overview imit behavior clone demonstr word imit,Imitation Learning in Tensorflow (Hopper from openAI gym),Live,667
669,import skill scientist abil clearli commun result gener audienc impact scientists’ work depend can…,Shiny: a data scientist’s best friend,Live,668
670,free sourc govern crime health financi econom market social media journal media real estat compani directori review start work project,70 Amazing Free Data Sources You Should Know,Live,669
671,aggreg oper stream design creat applic comput store statist stream,Calculate moving averages on real time data with Streams Designer,Live,670
672,list softwar librari tutori varieti program languag,Libraries and Tutorials,Live,671
673,review great tool work databas,SQLPro for Postgres and Keylord for Redis,Live,672
674,blog post tri predict chronic kidney diseas attribut collect hospit chronic kidney diseas ckd condit character gradual loss of…,Predict Chronic Kidney Disease Using SPSS Modeler Flows,Live,673
675,seti institute’ upcom hackathon code challeng set simul label set build signal classif model post will…,Simulating E.T. – Or: how to insert individual files into object storage from within a map function in Apache Spark,Live,674
676,work exampl row orient work frame explor analysi pattern discuss “split appli combine” row wise work frame split nest list column,Webinar: April 11 - Thinking inside the box: you can do that inside a data frame?!,Live,675
677,ibm cloudant sdk team proud announc releas cloudant sync io librari provid simpl storag api app,Cloudant Sync for iOS v1.0 is released,Live,676
678,devtool packag make easi build packag packag easi share code,Package Development with devtools  Cheat Sheet,Live,677
679,spark sql version run queri faster that’ good news berni schiefer ibm fellow stc engin deep expertise in rigor perform test nativ great ca…,Spark SQL - Rapid Performance Evolution,Live,678
680,latest big univers announc news world big blog,This Week in Data Science,Live,679
