,doc_description,doc_full_name,doc_status,article_id
346,seen work scienc prove exist map egregi gerrymand seen work scienc draw optim fair map challeng draw optim fair map reason peopl disagre make map fair believ map perfectli rectangular district common sens approach map optim elector competit gerrymand opposit effect peopl map racial divers account exampl sate hispan congression district major hispan,Fighting Gerrymandering: Using data science to draw fairer congressional districts,Live,346
347,environ defin relationship tool softwar configur hardwar configur exampl creat jupyt notebook environ configur anaconda vcpu ram,Announcing DSX Environments in Beta!,Live,347
348,here’ week’ news scienc big,"This Week in Data Science (April 25, 2017)",Live,348
349,white paper introduc sparkr packag statist program languag enabl programm scientist access larg scale memori process runtim singl thread normal run singl process set fit machine’ memori provid bridg spark’ distribut comput engin sparkr enabl larg job run multipl core singl node massiv parallel cluster access memori cluster,IBM Data Science Experience White paper - SparkR Transforming R into a tool for big data analytics,Live,349
350,you’v got fitbit christma break you’v got year resolut onlin graph dashboard you’r pleas graph inform i’m go teach collect fitbit littl python code,Collect Your Own Fitbit Data with Python,Live,350
351,flexibl program languag design facilit exploratori analysi classic statist test high level graphic rich expand librari packag lead edg develop statist analyt mine proven use tool grow field big integr commerci packag ibm spss infospher mathematica articl offer statistician perspect valu,Do I need to learn R?,Live,351
352,scienc team sport sentiment ring true experi ibm enterpris custom ask advic structur scienc team organ,How IBM builds an effective data science team,Live,352
353,we’r excit today announc sparklyr packag provid interfac apach spark past coupl years we’v heard people …,sparklyr — R interface for Apache Spark,Live,353
354,descript,Build the search index in Cloudant,Live,354
355,video show analyz shini applic ibm scienc experi dsx,Run Shiny Applications in RStudio in DSX,Live,355
356,earlier month excit opportun moder discuss professor yann lecun christoph man,"Deep Learning, Structure and Innate Priors",Live,356
357,datalay conf video instal week hear surviv failur rabbitmq lorna jane mitchel,Lorna Jane Mitchell & Surviving Failure with RabbitMQ,Live,357
358,switch newer mongodb driver low level improv meteor work better compos mongodb,"Meteor 1.4, MongoDB and Compose - Ready to Oplog",Live,358
359,retail bank maxim expect revenu market campaign direct custom limit budget jupyt notebook describ post present combin of…,Optimizing a marketing campaign: Moving from predictions to actions,Live,359
360,cloudant dan demichel introduc cloudant queri declart queri languag nosql mongodb queri languag,"Intro to Cloudant Query, declarative query API for JSON",Live,360
361,locat tracker exampl app show simpl cloudant track store queri geojson support offlin design futur scale,Location Tracker: Offline first design in Swift,Live,361
362,seri tutori we’ll showcas combin strength dsx cloud dsx local watson,DSX: Hybrid Mode,Live,362
363,follow inform help ibm bluemix connect consum load rest api port ibm watson api flow servic high level activ json data…,Migration from IBM Bluemix Data Connect API (activities) to IBM Watson Data API (data flows),Live,363
364,thirti sixth releas weekli round interest scienc big news link upcom event,"This Week in Data Science (October 18, 2016)",Live,364
366,aw lambda servic treat function independ unit apex provid framework treat set function project,Go Serverless with Apex and Compose's MongoDB,Live,365
367,find cluster power tool understand explor task sound easi surprisingli difficult,Clustering: A Guide for the Perplexed,Live,366
368,blog we’r go add npm modul notebook creat visualis code pixiedust node helper…,Visualising Data the Node.js Way,Live,367
369,shovel driveway time burn netflix que counter act cabin fever hunt snowfal play nation weather servic contain snowfal depth measur collect varieti sourc region point storm,Snowzilla!,Live,368
370,creat account ibm scienc experi provis free apach spark cluster free ibm object storag user share have troubl loading…,Upload data and create Data Frames in Jupyter Notebooks,Live,369
371,fathom advanc manufactur like challeng build print incub effici har collect power profession printer manufactur floor,Making the most of Compose - Customer: FATHOM,Live,370
372,bradley holt present webinar explor transform ibm cloudant locat tracker applic couchapp tier app you’ll add user manag function leverag cloudant queri display map individu user locat app,Integrate User Management and Cloudant Query into a Node.js & Cloudant Application,Live,371
373,store convers graph add recommend featur chatbot exampl app code,Have you had “The Talk” with your chatbot about graph data structures?,Live,372
374,scienc experi dsx complet platform build collabor differ featur enhanc experi let’ explor important…,Working with notebooks in DSX,Live,373
375,cloudant sync allow creat nativ mobil app io android store local sync cloudant onlin allow mobil applic continu work offlin deliv great user experi,"Introducing Cloudant Sync, Open Source Libraries for Mobile",Live,374
376,systemml includ make easier express algorithm provid automat optim ensur effici scalabl,Apache SystemML,Live,375
377,i’m plan releas earli novemb prepar i’d announc releas candid avail version tri file an issu,ggplot2 2.2.0 coming soon!,Live,376
378,transport work streamlin mission move joy chore,Transporter 0.3.0 Released - Transporter Streamlined,Live,377
379,watch interact self servic analyt visual dashdb watson analyt,Use dashDB with Watson Analytics,Live,378
380,solv real world problem design cool product algorithm have skill good work knowledg structur the…,Data Structures Related to Machine Learning Algorithms,Live,379
381,simpl python notebook combin dashdb warehous apach spark provid valuabl insight larg problem,"Analyze Market Trends in Twitter Using Apache Spark, Python, and dashDB",Live,380
382,easi interviewe bash entir interview process take forev it’ pain demor it’ easi interview lament difficulti in…,A Classification Problem,Live,381
383,detail text analyt rel matur excit form analysi gener signific busi valu wide rang enterpris,What is text analytics?,Live,382
384,python tool natur languag process sentiment analysi wrangl,An interview with Pythonista Katharine Jarmul,Live,383
385,build model watson,Continuous Learning on Watson,Live,384
386,load geospati dashdb databas analyz esri arcgi desktop,Load geospatial data into dashDB to analyze in Esri ArcGIS,Live,385
387,introduc concept document conflict look explain happen conflict left unresolv later seri tidi conflict discuss avoid,Introduction to document conflicts – Part One,Live,386
388,cloudant replic allow replic cloudant cluster provid global cdn databas blog post show power offlin design pattern store local sync cloud internet connect,Why Replication is Awesome,Live,387
389,second half mongodb exampl explor mongodb aggreg pipelin half seri cover mongodb valid exampl,Aggregations in MongoDB by Example,Live,388
390,differ version number make releas spark spark sql juli spark sql capabl perform improv impress,Apache Spark™ 2.0: Impressive Improvements to Spark SQL,Live,389
391,purpos system augment human today excit announc step journey access everybodi ibm watson studio,Introducing IBM Watson Studio ,Live,390
392,updat transport tool quicker start complet rebuilt elasticsearch adaptor updat mongodb adaptor postgresql adaptor lot intern engin improv,Building better database bridges with the new Compose Transporter,Live,391
393,ibm bluemix cloud foundri “cf push” command great deploy local cloud i’ll safer team autom deploy pipelin,Let the Build Server cf push – IBM Watson Data Lab,Live,392
394,familiar apach couchdb ecosystem cloudant envoy microservic serv static applic behav replic target databas user…,"Authentication for Cloudant Envoy Apps, Part I – IBM Watson Data Lab",Live,393
395,look basic cloud databas seri run compos intro programmat access enter cloudant,Seven Databases in Seven Days – Day 4: Cloudant,Live,394
396,launch scienc experi june we’v receiv feedback scientist piec feedback heard frequent dsx great enabling…,Run DSX Notebooks on Amazon EMR,Live,395
397,talk custom work industri differ compel caus,How Compose is Helping Educational Organizations Innovate,Live,396
398,ami tai princeton univers took stage discuss replex rethink index modern distribut datastor,DataLayer Conference: Rethinking Indexing in Data Stores with Replex,Live,397
399,today’ world scienc leverag sourc commonli sourc hadoop file enterpris warehous relat databas system enterpris file system etc…,Using Apache Spark as a parallel processing framework for accessing REST based data services,Live,398
400,post mostly concentrated on theoret topic gener focu blog broader  for i’m go actual applic probabl theori estim real life event ongo event many peopl close follow right presidenti elect primari season offici,Predicting The 2016 US Presidential Election,Live,399
401,articl bring rstudio dsx amazon write rstudio amazon ‘sparklyr’ work spark work…,Read and Write Data To and From Amazon S3 Buckets in Rstudio,Live,400
402,ken whipday show rabbitmq help tripcatch set basic amqp messag queue nodej rabbot power abstract rabbitmq cluster exchang queue,The Well Connected Rabbit,Live,401
403,metric maven seri compos scientist share databas featur tip trick code metric articl cozi calcul median postgresql,Metrics Maven: Meet in the Middle - Median in PostgreSQL,Live,402
404,spark stream combin ibm watson perform sentiment analysi track convers trend twitter,Show Twitter trends with Spark Streaming and IBM Watson,Live,403
405,reason adjust spark configur exampl librari requir kryo serial recommend creat project specifically…,Persistent changes to Spark Config in DSX,Live,404
406,articl learn window function postgresql foundat dive littl deeper window frame understand window frame import result window function depend window frame,Window Frames in PostgreSQL,Live,405
407,second releas weekli round interest scienc big news link upcom event,"This Week in Data Science (November 29, 2016)",Live,406
408,develop cloudant welcom list guid tutori start cloudant,Cloudant Learning Center,Live,407
409,compos elasticsearch rabbitmq deploy offer upgrad easier reliabl encrypt secur certif back connect,Let's Encrypt TLS Certificates,Live,408
410,tri project don’t fit nice notebook notebook nice point build integr folder structur project one…,Using GitHub for project control in DSX,Live,409
411,deploy rethinkdb deploy updat rethinkdb version rethinkdb user authent,Using RethinkDB 2.3's user authentication,Live,410
412,systemml spark shell ye simpl systemml big need tutori set run systemml spark shell star,0 to Life-Changing App: New Apache SystemML API on Spark Shell,Live,411
413,softwar develop organ cost defect verif extrem larg process trivial achiev requir follow specif use…,Adoption of machine learning to software failure prediction,Live,412
414,happi announc work friend hoodi bocoup bring offlin camp,Join us for Offline Camp,Live,413
415,emul filter replic chang feed openwhisk function,Custom Cloudant Replication – IBM Watson Data Lab – Medium,Live,414
416,product instrument airbnb’ servic long recogn it’ costli product exampl person search rank enables…,Using Machine Learning to Predict Value of Homes On Airbnb,Live,415
417,short video demonstr maker palett ibm scienc experi content quickli product tri http,Using the Maker Palette in the IBM Data Science Experience,Live,416
418,video provid overview ibm catalog watson platform,IBM Data Catalog Overview,Live,417
419,latest write stuff articl robert wysocki explain postgresql backup pick one pro con,"PostgreSQL, Backups and everything you need to know",Live,418
420,cloudant geospati let run nearest neighbor queri locat item close specif locat,Geospatial Nearest Neighbor Query,Live,419
421,user want improv perform cach tabl memori offer consider,CACHE Table in Apache Spark SQL,Live,420
422,goal wasn’t build best event concierg app illustr type thing build cognit servic ibm cloud,Navigating SXSW via cognitive chatbot – IBM Watson Data Lab,Live,421
423,current version releas note show featur ad,Brunel 2.0 Preview,Live,422
424,favourit retro game demo real notif web app use simpl notif servic npm modul rethinkdb real connect client server process,"Web application state, à la Dogfight (1983) – IBM Watson Data Lab",Live,423
425,watch creat tabl ibm dashdb,Create Tables in dashDB,Live,424
426,use gnuplot graph interact programmat script plu psql pull dump correct format,Turn Small Data Into Smart Data. Part 3,Live,425
427,short guid featur python scientist,Migrating to Python 3 with pleasure,Live,426
428,sign catalog choic plan lite profession check key highlight,IBM Data Catalog is now generally available,Live,427
429,ibm scienc experi stop shop scientist creat collabor video armand ruiz gabernet,Data Science Experience Demo: Modeling energy usage in NYC,Live,428
430,relat databas,Why Relational Databases and R?,Live,429
431,david taieb jorg castañón built refin sampl app predict flight delay weather movement tool apach spark,The New Builders podcast Ep 3: Collaboration,Live,430
432,power softwar help understand world immens compani dronedeploy bring power goal sky access product includ farmer look better crop yield architect look restor cathedr miner want optim excav,Making the Most of Compose - Customer DroneDeploy,Live,431
433,couchdb read write oper behav distribut cluster cross post mike rhode,Learn how read/write ops in CouchDB 2.0 work in a cluster,Live,432
434,updat sampl chatbot latest graph databas,A Depth-First Look at Watson Conversation + Gremlin + JanusGraph,Live,433
435,conquer layer alec summer cto icar chose compos decid ask said,Customer: iCars Conquers the Data Layer,Live,434
436,python flask rest web app serv file ibm object storag requir authent,Build a simple data portal with Python and IBM Object Storage,Live,435
437,lucero del alba illustr power postgresql aggreg date function analyz financi show display result web browser techanj,Building OHLC Data in PostgreSQL,Live,436
438,watch video start ibm watson wml provis necessari servic ibm bluemix,IBM Watson Machine Learning: Get Started,Live,437
439,programmat search index date json chang couchdb cloudant simpl search servic quick facet search websit,Database changes and search indexes that go together like wine & cheese – IBM Watson Data Lab,Live,438
440,look basic cloud databas seri compos ibm cloud enter redi,Seven Databases in Seven Days – Day 7: Redis,Live,439
441,here’ week’ news scienc big,"This Week in Data Science (January 24, 2017)",Live,440
442,add aggreg microservic microservic app perform simpl stream analyt,Multiplying Microservices,Live,441
443,cloudant queri give declar defin queri index databas mongodb queri languag cloudant queri make simpl queri simpl oper,Introducing Cloudant Query,Live,442
444,video show load warehous cloud scala notebook spark ibm scienc experi dsx,Load Db2 Warehouse on Cloud data with Apache Spark in DSX,Live,443
445,explor studi construct algorithm predict field scientist special analyzi…,Declarative Machine Learning,Live,444
446,articl look market tech compani work compos conquer layer,How Marketing Technology Companies Use Compose to Conquer Their Data Layer,Live,445
447,we’r excit announc gener avail refineri self servic prepar tool got feedback month help tremend to…,What’s New in Data Refinery?,Live,446
448,follow queue broker technolog handl app workload javascript async librari redi rabbitmq apach kafka ibm messag hub,Get in line! An Intro to Queues and PubSub,Live,447
449,here’ week’ news scienc big,"This Week in Data Science (April 11, 2017)",Live,448
450,articl won take deep dive index virtual column focus keep simpl creat tabl store json document includ list game player game play,MySQL for your JSON,Live,449
451,dismay hear news north carolina anti lgbt known thought ran head person profession,On the Passage of HB2 in North Carolina,Live,450
452,video show chang databas permiss cloudant databas,Change Database Permissions in Cloudant,Live,451
453,compos allow custom deploy databas datacent world commit provid locat divers flexibl account privaci law unit state countri store,Data Privacy and Governance Update,Live,452
454,introduc unoffici shallow wrapper librari ibm graph make rest api easier modul ibm graph client npm,Baby’s first IBM Graph app using Node.js – IBM Watson Data Lab,Live,453
455,modifi databas,"Database Design, Load, and Query from R",Live,454
456,fundament chang approach comput pay big busi,Make machine learning a reality for your enterprise,Live,455
457,bluemix object storag servic prepar multipl region support precipit analysi sampl notebook updat,Bluemix Object Storage Enhanced: Update Precipitation Analysis Sample Notebook,Live,456
458,articl walk simpl exampl compose’ dbaa offer ibm bluemix ibm’ develop cloud platform,Getting Started with Compose and Bluemix,Live,457
459,talk php tek caught eye cover code amanda folson engin work develop relat she’ consum api visible…,10 Things I Hate About Your API — Amanda Folson – IBM Watson Data Lab – Medium,Live,458
460,code built shelf life code typic depend motiv build ideal code built highest profession standard we…,Hacking vs. Prototyping vs. Production Code – IBM Watson Data Lab – Medium,Live,459
461,week interest scienc link web,Web Picks - DataMiningApps,Live,460
462,here’ week’ news scienc big,"This Week in Data Science (September 13, 2016)",Live,461
463,post discuss driven approach predict outcom nba game elast nba rank love statist basketbal post,I'd Rather Predict Basketball Games Than Elections: Elastic NBA Rankings,Live,462
464,spark larg amount requir low latenc process typic map reduc program provid,What is Spark?,Live,463
465,recip show ibm scienc experi tool detect anomali histor timeseri creat rule ibm watson iot platform anomali,Use IBM Data Science Experience to detect time series anomalies,Live,464
466,neural network ann use process brain basi develop algorithm complex pattern predict problem,"Introduction to Neural Networks, Advantages and Applications",Live,465
467,today excit introduc compos elasticsearch browser make elasticsearch deploy easier manag web immedi access elasticsearch api leav compos consol,Compose's Data Browser comes to Elasticsearch,Live,466
468,articl discuss convert shapefil sql geojson import compos postgresql mongodb,GeoFile: Converting and importing shapefiles for Compose PostgreSQL and MongoDB,Live,467
469,dig breakdown hadoop compon gain understand flexibl open sourc hadoop framework perform big analyt,What is Hadoop?,Live,468
470,connect applic come dashdb fulli manag warehous servic cloud,Connect apps to dashDB,Live,469
471,combin releas latest ibm stream analyt servic ibm bluemix version python applic api introduc suit python languag featur greatli eas develop stream applic cloud,What’s new in the Streaming Analytics service on Bluemix,Live,470
472,guid tool interact cloudant program languag,Using Cloudant with Node.js,Live,471
473,video cover advanc techniqu cloudant secondari index,Use advanced techniques with the secondary index in Cloudant,Live,472
474,chang interact machin relat world past decad given self drive car speech recognit effect web search vastli improv understand human genom,Intelligent applications - Apache Spark,Live,473
475,video show connect ibm scienc experi dsx account github account,Publish notebooks to GitHub in DSX,Live,474
476,purpos articl lay groundwork classic gradient boost intuit comprehens,Gradient Boosting Explained,Live,475
477,postgresql team compos busi work way control postgresql deploy work avail perform view let tabl index extens view let extens avail instal instal,Compose PostgreSQL's new Performance and Extensions views,Live,476
478,beauti graph notebook great explanatori text look good can’t rememb markdown tag creat cheatsheet head follow,Markdown for Jupyter notebooks cheatsheet,Live,477
479,access enterpris class dashdb servic bluemix walk step creat simpl chart applic use dashdb servic deploy bluemix,Create a business intelligence and analytics service in Ruby with the dashDB            service,Live,478
480,access analyz intern extern sourc pose practic problem impos signific drag analyt effort,Drowning in data sources: How data cataloging could fix your findability problems,Live,479
481,overview excit highlight research direct optim deep,Optimization for Deep Learning Highlights in 2017,Live,480
482,norman barker chri glew talk cloudant creat geospati applic ship logist transport,"Building Mobile Apps At The Geospatial Edge For Shipping, Logistics, & Transportation",Live,481
483,predict custom churn deep kera produc neural network ann ibm watson telco custom churn set,Using Deep Learning With Keras To Predict Customer Churn,Live,482
484,evalu convert ddl sql dashdb,Convert IBM Puredata for Analytics to dashDB,Live,483
485,run cloud great resourc share common pool resourc critic enterpris workload selfish,Compose Enterprise comes to Bluemix,Live,484
486,articl start design complex trade strategi non constant weight,A Moving Average Trading Strategy,Live,485
487,sparkr provid distribut frame api enabl structur process syntax familiar user,Use Spark R to Load and Analyze Data,Live,486
488,basic couchdb php applic excel php http librari guzzl,Get Started With CouchDB Using PHP and Guzzle,Live,487
489,articl go run queri nest field,Getting started with Elasticsearch and Node.js - part 4,Live,488
490,ami unruh give overview cloud spanner googl relat scalabl applic databas,Amy Unruh & Scaling Out SQL Databases with Spanner,Live,489
491,hoodi fast simpl self host backend servic web app short hoodi make build offlin app breez plu hoodi team commit wonderful…,Hoodie App Tracker is now deployable to IBM Bluemix,Live,490
492,here’ week’ news scienc big,"This Week in Data Science (May 23, 2017)",Live,491
493,interest scienc link web,Web Picks by DataMiningApps,Live,492
494,thirti fifth releas weekli round interest scienc big news link upcom event,"This Week in Data Science (October 11, 2016)",Live,493
495,python loop iter sequenc list string dictionari rang articl i’ll syntax logic best practic,Python For Loops Explained (Python for Data Science Basics #5),Live,494
496,start field decid reboot immens popular gold blog algorithm engin,Top 10 Machine Learning Algorithms for Beginners,Live,495
497,build collect larg scale public petit idea comput power you’d site perform serverless compel,How I used serverless infrastructure to build a large-scale petition system – IBM Watson Data Lab,Live,496
498,etcd fine databas coordin configur backup restor design assumpt aren good fit host servic pleas come etcdtool util,"Backups, etcd and etcdtool",Live,497
499,power command line control compos databas deploy bach tool easi har mighti compos api,Bach - The Compose API at your command(line),Live,498
500,discov consider specif set real world case enabl scientist implement cost effect visual,Let data dictate the visualization,Live,499
501,deep term interchang,"The Difference Between AI, Machine Learning, and Deep Learning?",Live,500
502,seti ibmcloud project seti institute’ hackathon code challeng reli ibm infrastructur cloud foundri runtim apach spark openstack object storag of…,Defensive IBM Object Storage Containers – IBM Watson Data Lab – Medium,Live,501
503,here’ week’ news scienc big,"This Week in Data Science (August 02, 2016)",Live,502
504,heard compos user connect mongodb java ssl somewhat difficult process go illustr process strip exampl,Connecting to Compose MongoDB with Java and SSL,Live,503
505,sixth releas weekli round interest scienc big news link upcom event,"This Week in Data Science (December 27, 2016)",Live,504
506,make proper connect pool massiv improv perform mongodb deploy,Connection Pooling with MongoDB,Live,505
507,creat custom email server breez postal compos deep dive articl tackl email,Conquer Email with Postal and Compose,Live,506
508,watch gener sql report cloudant json dashdb embedd report servic,Use dashDB with IBM Embeddable Reporting Service,Live,507
509,scienc grow special touch follow topic cloud comput big math busi theori scienc theori script languag python great choic typic cycl prototyp sure math problem work product result distribut farm cloud server articl present hand exampl invest analysi statist analysi ipython panda,Data science in the cloud,Live,508
510,heard graph databas right write stuff articl graham cox look concept applic graph databas,Introduction to Graph Databases,Live,509
511,here’ week’ news scienc big don’t forget subscrib use interest scienc articl news manag spark handl,"This Week in Data Science (May 30, 2017)",Live,510
512,video show creat simpl python flask web applic end deploy logist regress real ibm waston ibm scienc experi video continu logist regress analysi video,Put a human face on machine learning with WML & DSX,Live,511
513,kaggl platform predict model analyt competit compani research post statistician miner world compet produc best problem face kind competit dataset big handl regular memory…not cpu power process performant…so then…what particip pay expens money cloud environ ibm bluemix dashdb,Use #Bluemix DashDB and R to solve a Kaggle Competition,Live,512
514,creat text search index built apach lucen cloudant search step step guid show,Search Indexes,Live,513
